id,sentence_index,source_text,translated_text
22658,8,其他菜也都不错没有不好吃的，推荐想找特别口味又敢尝试新餐厅的朋友来试试。,"suitable. The other dishes are also good, there is nothing bad to eat, and it is recommended for friends who want to find a special taste and dare to try a new restaurant."
19409,0,屋头有个喜欢苏杭一切视苏杭为第二故乡的妹，自然早耳闻“绿茶”大名。,"There is a sister at the head of the house who likes everything in Suzhou and Hangzhou and regards Suzhou and Hangzhou as her second hometown, so she has naturally heard of the name of ""green tea""."
19409,1,由于太古里店人多的天天顿顿都要排位，实在是莫的等位的心。,"Due to the large number of people in the Taikoo Li store, it is really Mo's waiting heart."
19409,2,\\n今天是绿茶万象城新店第一天开业，除水产、甜品、酒水外其余打六折。,"\\nToday is the first day of the opening of the new store in the green tea mixc, except for aquatic products, desserts, and wines, the rest are discounted by 6%."
19409,3,胜在离家近，下午3点半就来取号了。,"The victory is close to home, and I came to pick up the number at 3:30 in the afternoon."
19409,4,\\n五点二十到店一看，已经人山人海了。,"\\nWhen I arrived at the store at 5:20, it was already crowded."
19409,5,\\n终于进店入座，点有绿茶烤鸡肉合拼、果蔬沙拉、三样菜、椒香蛙、年糕炒牛仔骨、花生莲藕排骨汤。,"\\nFinally, I entered the restaurant and ordered green tea roasted chicken assortment, fruit and vegetable salad, three kinds of vegetables, pepper frog, fried cowboy bones with rice cake, and pork rib soup with peanut and lotus root."
19409,6,三样菜就焯过水的豇豆，藕，苦瓜合拌，口味太淡吃不惯。,"The three dishes are blanched cowpeas, lotus root, and bitter gourd, and the taste is too light to eat."
19409,7,好吃的是绿茶烤鸡肉里的烤肉，我们点了两次，而且一定要趁热吃，肥而不腻，瘦肉也嫩，相比较，烤鸡肉的肉质就有点柴了。,"The delicious is the barbecue in the green tea roast chicken, we ordered it twice, and it must be eaten while it is hot, fat but not greasy, lean meat is also tender, in comparison, the meat quality of the roast chicken is a bit chai."
19409,8,其他菜不功不过。,Other dishes are not to the task.
19409,9,\\n在万象城这样的环境下，菜品不错，价格适中。,"\\nIn an environment like the MixC, the dishes are good and the prices are"
19409,10,下次再试试其他的菜。,moderate. Try other dishes next time.
26380,0,最近朋友圈里刷屏的一家餐厅，慕名而来，下午五点不到上座率已经达到90%，完全符合茶餐厅的样子，人很多，也很吵杂，不只是顾客的交流声，更大的是收拾盘子之类的声音，并不是个可以安静吃饭聊天的地方。,"Recently, a restaurant in the circle of friends swiped the screen, admiring it, the attendance rate has reached 90% before five o'clock in the afternoon, which is completely in line with the appearance of a tea restaurant, there are a lot of people, and it is also very noisy, not only the communication of customers, but also the sound of cleaning up the plates, and it is not a place where you can eat and chat quietly."
26380,1,上菜速度较慢，每道菜都有等很久，菜的口味还可以，没吃过真宗的粤菜，所以没什么比较，但和南京一般的粤菜餐厅感觉差不多。,"The speed of serving is slow, each dish has to wait for a long time, the taste of the dish is OK, I have not eaten the real Cantonese cuisine, so there is no comparison, but it feels similar to the general Cantonese restaurant in"
26380,2,点的茶走、猪仔包，法式长面包、咖喱牛腩、云吞、猪排饭，茶走茶味很重，有点涩口，加了一包糖感觉很好喝，猪仔包甜而不腻很好吃，长面包里熏肠的味道很重，搭配起来也很不错，咖喱牛腩的咖喱味道不重，所以不太喜欢，云吞的里满满的虾仁，吃起来很爽口，猪排饭就有点失望，饭是软的软硬的硬，芝士不多，里面的配菜是胡萝卜，吃起来没有什么味道。,"Nanjing. The tea left, piglet buns, French baguettes, curry brisket, wonton, pork chop rice, the tea taste is very strong, a little astringent, it feels very delicious with a pack of sugar, the piglet buns are sweet but not greasy and delicious, the taste of smoked sausage in the long bread is very heavy, and the curry taste of curry brisket is not heavy, so I don't like it very much, the wonton is full of shrimp, it tastes very refreshing, the pork chop rice is a little disappointed, the rice is soft and hard and hard, there is not much cheese, the side dish inside is carrots, and there is no taste in it."
23817,0,我觉得蟹没有洗干净，但是肉蟹煲的味道比别的味道好！,"I don't think the crab is cleaned, but the taste of the meat crab pot is better than the others!"
23817,1,看评论说年糕好吃，可是我觉得年糕已经太烂了，没有咬劲了，并不是好年糕！,"I read the reviews that the rice cakes are delicious, but I think the rice cakes are too bad and have no bite, so they are not good rice cakes!"
23817,2,反倒是凤爪尽管酥烂，却也入味！,"On the contrary, although the phoenix feet are crispy, they also taste good!"
23817,3,\\n,"\\n Meal ོ can ོ not ོ can make ོ dry ོ net ོ point ོ ah ོ, like ོ is ོ is ོ used ོ eight ོ hundred ོ years ོ up, that ོ cup ོ and chopsticks ོ simple ོ straight ོ not ོ want to spit out the groove ོ up, estimate ོ meter light light ོ engage ོ into ོ this ོ like ོ except ོ is ོ a kind of wind ོ grid ོ to ོ outside ོ also ོ is ོ for ོ mold paste ོ view line"
23817,4,餐ོ具ོ能ོ不ོ能ོ弄ོ干ོ净ོ点ོ啊ོ，像ོ是ོ被ོ用ོ了ོ八ོ百ོ年ོ了ོ，那ོ个ོ杯ོ子ོ和ོ筷ོ子ོ简ོ直ོ不ོ想ོ吐ོ槽ོ了ོ，估ོ计ོ灯ོ光ོ搞ོ成ོ这ོ样ོ除ོ了ོ是ོ一ོ种ོ风ོ格ོ以ོ外ོ也ོ是ོ为ོ了ོ模ོ糊ོ视ོ线ོ。\\n等位这件事就不说了，谁让我自己在星期五晚上去呢！,"ོ. \\nWaiting for a seat, who told me to go on Friday night!"
38162,0,这家店在北行往前走那条街上，位置按照点评地图来找还是很好找的。,"This shop is on the street in front of the northbound line, and the location is still easy to find according to the review map."
38162,1,店铺给人感觉不是很大，但是进屋却发现并不拥挤，而且还有二楼。,"The shop doesn't feel very big, but when you enter the house, you find that it is not crowded, and there is a second floor."
38162,2,\\n买了一张代金券比较合适，又补了三十的现金，整顿饭下来才一百二左右，很划算的。,"\\nI bought a voucher and made up thirty cash, and the whole meal was only about one hundred and twelve, which was very cost-effective."
38162,3,\\n他家很多网友推荐的我都点了，比如铁板玉米粒，里面都是酸奶的味道，非常好吃！,"\\nI ordered the ones recommended by many netizens in his family, such as sizzling corn kernels, which are full of yogurt flavor, very delicious!"
38162,4,大赞！,Great praise!
38162,5,拉面炒年糕也太辣了，有点来不了。,The ramen fried rice cake is also too spicy to come.
38162,6,草莓那个饮料不错，但是有点小贵。,"Strawberry drink is good, but a little expensive."
38162,7,炸鸡虽然要的是果酱的，但是果酱有点太少了吧，不过味道还是很不错的。,"Although the fried chicken is made with jam, the jam is a little too little, but it still tastes very good."
38162,8,\\n他家点餐完毕要先交钱后上餐，给人感觉有点要抢钱的意思，这样还是再点餐感觉很麻烦了。,"\\nAfter his family orders the food, he has to pay the money before serving, which gives people the feeling that they want to grab money, so it feels very troublesome to order"
38162,9,\\n性价比挺高的一家店，推荐哦。,"again. \\nA very cost-effective store, recommended."
19815,0,带着父母慕名而来，可是让我略微有点失望，客人不多但服务员态度比较冷淡，点菜时有点不耐烦。,"I came with my parents, but I was a little disappointed, there were not many guests but the waiter was relatively cold, and I was a little impatient when ordering."
19815,1,我们都点了特色菜。,We all ordered specials.
19815,2,【松鼠桂鱼】甜中带酸价位属于贵的，而味道我也能在上海的一般饭店里吃得到，没有想象的那么赞。,"【Squirrel Guiyu】The price of sweet and sour is expensive, and the taste can also be eaten in ordinary restaurants in Shanghai, which is not as good as I imagined."
19815,3,【得月小炒】就是只看见鸡头米和藕块，味道清淡，78元的价位并不值。,"[Deyue Stir-fry] is only to see chicken head rice and lotus root, the taste is light, and the price of 78 yuan is not worth it."
19815,4,【蟹粉豆腐】这个菜还比较满意，蟹粉比较多。,"【Crab Roe Tofu】This dish is quite satisfying, and there is more crab roe."
19815,5,【梅菜扣肉】肉非常嫩，入口即化，梅菜又甜又糯，这个菜可以的。,"【Plum cabbage button meat】The meat is very tender, it melts in the mouth, the plum cabbage is sweet and glutinous, this dish is okay."
19815,6,【油爆虾】做的非常入味，虾也比较大。,"【Fried shrimp】It is very flavorful, and the shrimp is relatively large."
19815,7,【酒酿圆子】这个最最需要吐槽，简直是个败笔，端上来是温的，汤水我没有勾芡就像清汤一样，小圆子都粘在一起沉在碗底，这个菜我都不高兴拍照了。,"[Wine-stuffed balls] this is the most important to complain, it's a failure, it's warm when served, I didn't thicken the soup like a clear soup, the small balls are stuck together and sink at the bottom of the bowl, I am not happy to take pictures of this"
19815,8,总的来说不会再来第二次了,dish. Overall will not come back a second time
11709,0,吃水煮鱼的话非新煮意莫属啊！,"If you eat boiled fish, it must be a new cooking!"
11709,1,由于只有两个人，想挑一条小一点的鱼，不过服务员一直推荐我们点一份的。,"Since there were only two people, we wanted to pick a smaller fish, but the waiter kept recommending us to order one."
11709,2,自认为论份的和论斤称的味道不太一样，而且一份的鱼对于我们两个吃货也太少了点，还是坚持了论斤称。,"I think that the taste of the argument is not the same as the argument of the pound, and a portion of the fish is too little for the two of us foodies, so I still insisted on the pound."
11709,3,挑到一条两斤七两，主力就是吃鱼来的嘛，我们两个人也吃的差不多。,"Pick a two catties and seven taels, the main force is to eat fish, and the two of us also eat about the same."
11709,4,这的水煮鱼属于只麻不辣，虽然端上来飘满了红辣椒，其实一点都不辣，但是味道很香，而且够麻，一级棒！,"This boiled fish is only spicy, although it is served full of red peppers, in fact, it is not spicy at all, but the taste is very fragrant, and it is numb enough, first-class great!"
11709,5,\\n怕鱼吃多了会腻，点了一个水果大拌菜，好像是用苹果汁和雪碧调的汁，还不错。,"\\nI was afraid that I would get tired of eating too much fish, so I ordered a fruit salad, which seemed to be made with apple juice and Sprite, which was not"
11709,6,水果茶也很好喝，担担面也好吃，不过那个豆花可不好吃，太甜了……,"bad. The fruit tea is also delicious, and the dandan noodles are also delicious, but the bean curd is not delicious, it is too sweet......"
17030,0,大众点评奖抽到朱朱农家乐多人套餐免费吃，电话预约后，跟着导航仪开去，一路上风光如画。,"The public review prize was drawn to the Zhuzhu Farmhouse multi-person package for free, and after making an appointment by phone, follow the navigator and drive away, and the scenery along the way is picturesque."
17030,1,从湖滨路拐进乡路后，在老板娘的电话指点下，很快就找到了朱朱农家乐。,"After turning from Hubin Road to Xiang Road, under the guidance of the proprietress's phone, I quickly found Zhu Zhu Farmhouse."
17030,2,车到那儿，眼前豁然开朗，一大片湖水，碧波荡漾，湖里养着鹅鸭，泊着供食客游玩的游船。,"When the car arrives there, the eyes suddenly open up, a large lake with rippling blue waves, geese and ducks in the lake, and pleasure boats for diners to play."
17030,3,\\n\\n朱朱农家乐临湖而建，雪白的粉墙上，大红的店名很是醒目，墙前有花架花草，喜气而时尚。,"\\n\\nZhu Zhu Farmhouse is built near the lake, on the snow-white powder wall, the red store name is very eye-catching, there are flower stands in front of the wall, festive and fashionable."
17030,4,院子宽敞洁净，可停好几辆汽车。,"The yard is spacious and clean, and there is room for several cars."
17030,5,院子一角停着供食客骑游的自行车。,"In the corner of the yard, bicycles are parked for diners."
17030,6,这儿有免费wifi，有男女卫生间。,There is free Wi-Fi and men's and women's toilets.
17030,7,楼房里有大小包厢。,There are large and small private rooms in the building.
17030,8,临湖建有木顶大棚，下设餐桌餐凳。,"There is a wood-roofed greenhouse near the lake, and there are dining tables and stools under it."
17030,9,天洒小雨，前来用餐者不少，大多是上海人，不少还是回头客。,"There was a light rain on the day, and there were many people who came to dine, most of them were Shanghainese, and many of them were repeat customers."
17030,10,\\n\\n我们当然选择在湖边大棚用餐。,"\\n\\nOf course, we chose to dine in a tent by the lake."
17030,11,那儿视野开阔，空气清新，凉风阵阵，还有大群白鹅相伴，舒适写意至极。,"There is a wide view, fresh air, cool breezes, and a large flock of white geese, which is extremely comfortable and freehand."
17030,12,年轻清秀的老板娘接待热情周到，有宾至如归之感。,The young and handsome hostess was warm and attentive and made her feel at home.
17030,13,上菜了，小葱跑蛋色泽金黄，葱花碧绿，香气扑鼻；,"When the dish is served, the shallot running egg is golden in color, the green onion is green, and the aroma is tangy;"
17030,14,盐水河虾、酱爆螺丝只只新鲜味美，原汁原味的农家味；,"Saltwater river shrimp and sauce fried screws are only fresh and delicious, and the original farmhouse flavor;"
17030,15,一大盆六月黄，壳薄黄多，一嚼满嘴鲜香，超级鲜美；,"A large pot of June yellow, the shell is thin and yellow, and the mouth is full of fresh and fragrant when chewed, super delicious;"
17030,16,最为惊艳的是红烧鳊鱼，那个大呀，起码要二斤半以上，浓油赤酱，鱼肉紧致细嫩，味道不是一般的好哈！,"The most amazing thing is the braised bream, which is big, at least more than two and a half catties, thick oil red sauce, the fish meat is firm and tender, and the taste is not ordinary!"
17030,17,炒青菜和土鸡汤味道也很赞。,The stir-fried vegetables and local chicken soup also taste great.
17030,18,菜量大，味鲜美，我们四人都吃撑了，真正是大快朵颐！,"The amount of dishes is large, the taste is delicious, and the four of us have eaten it, and we are really feasting!"
17030,19,\\n\\n餐后，我们没去骑游、乘游船，由老板娘指引，去采摘了葡萄。,"\\n\\nAfter the meal, we didn't go on a ride or a cruise, and we were guided by the hostess to pick grapes."
17030,20,老板娘毕业于苏州的大学，怪不得品位不俗，把个农家乐搞得这样有情调。,"The proprietress graduated from a university in Suzhou, no wonder she has good taste and makes a farmhouse so emotional."
17030,21,去之前绝对想不到,"Before I went, I would never have imagined that Bacheng would hide such a farmhouse with beautiful scenery, beautiful dishes and beautiful paradise."
17030,22,，巴城竟隐藏着这么一家风光美、菜肴美、美如世外桃源的农家乐。,"Before we left, we thought that next time we would call friends and come to Zhuzhu"
17030,23,我们人还没离开，心里就想着下次要呼朋唤友，再来朱朱农家乐了。\\n\\n,Farmhouse. \\n\\n
1882,0,上一次本来想吃，但是晚上人多而且服务感觉不好，就被气走了。,"I wanted to eat it last time, but there were many people at night and the service didn't feel good, so I was angry and left."
1882,1,这次聚餐选的这边，还是来试试吧。,"The side chosen for this dinner, let's try it."
1882,2,中午人不多，比较舒服，走菜也快。,"There are not many people at noon, it is more comfortable, and the food is fast."
1882,3,点的都是大家好评的菜，鲈鱼，蒜香骨，感觉不错，日本豆腐也还好，蛏子肥肥的也很不错，茶皇虾我觉得普通，虾子少，茶叶多一点。,"The dishes ordered are all well received by everyone, sea bass, garlic bones, it feels good, Japanese tofu is also good, razor clams are also very good, tea king shrimp I think ordinary, shrimp less, tea tea a little more."
1882,4,要的黑雕的鱼生，鱼骨做粥，但是感觉粥炖的时间太短，味道不浓，鱼生上来的时候大家都在惊呼：鱼肉在哪里？,"I want the fish sheng of the black eagle, the fish bones make porridge, but I feel that the porridge stew time is too short, the taste is not strong, and when the fish is born, everyone is exclaiming: Where is the fish?"
1882,5,好吧，因为鱼肉实在是太薄了！,"Well, because the fish is so thin!"
1882,6,148的鱼生，感觉还不够塞牙缝，下次还是吃三文鱼刺身得了！,"148 yusheng, I don't feel like it's enough to stuff my teeth, next time I can eat salmon"
1882,7,榴莲酥还不错，榴莲量多，货真价实~ 总体还是满意的，不过鱼生觉得有点贵了！,"sashimi! The durian crisp is not bad, the amount of durian is large, and the goods are genuine~ Overall I am still satisfied, but Yusheng thinks it is a bit expensive!"
38150,0,这家店在云岗开了很多很多年，最开始的时候很火爆，量足价格也实惠，基本每周都去个一两次。,"This store has been open in Yungang for many, many years, and it was very popular at the beginning, and the price was affordable, so I basically went once or twice a week."
38150,1,后来分店也开的多了，菜价也上去了，但是菜品质量下降严重。,"Later, more branches were opened, and the price of dishes also increased, but the quality of the dishes declined seriously."
38150,2,人气没有以前旺了，但饭点也还有上座率，一层南侧有一个个小隔断的包间，比较私密，可以坐4人，就是推拉门设计的好，这边人进去，那边人就肯定出不来，服务员上菜的时候也费劲。,"The popularity is not as strong as before, but the meal also has the attendance rate, there is a small partition on the south side of the first floor, which is more private, you can sit 4 people, it is a good design of the sliding door, people here go in, people over there will definitely not be able to get out, and the waiter will also struggle when serving the food."
38150,3,#宫保鸡丁#这菜实在是“赞”，几十元买一盘宫保大葱和不脆的花生米。,"#宫保鸡丁#这菜实在是 ""like"", a few dozen yuan to buy a plate of kung pao green onions and non-crispy peanuts."
38150,4,#扇贝#扇贝应该是不完整的吧，因为扇贝的壳够大，但是里面那块味如嚼蜡的死肉挺小，值得肯定的是扇贝上面的蒜蓉粉丝味道不错。,"#扇贝#扇贝应该是不完整的吧, because the shell of the scallop is large enough, but the piece of dead meat that tastes like chewing wax inside is quite small, it is worth affirming that the garlic vermicelli on the scallop tastes good."
38150,5,#铁板茄子#大概是这个名字，原来是必点，长条茄子里面有肉馅，放在铁板上端上来甜甜的很好吃，但是这次的我翻来翻去找肉馅，几乎没有！,"#铁板茄子#大概是这个名字, it turned out to be a must-order, the long eggplant has meat filling in it, and it is sweet and delicious when served on the iron plate, but this time I rummaged through it to find the meat filling, and there was almost none!"
38150,6,#米粉肉#巨肥，直接浪费了，实在没法入口。,"#米粉肉#巨肥, it's wasted directly, and it really can't be entered."
38150,7,#咸蛋黄南瓜#还是可以的，水准没有降低，趁热吃不错。,"#咸蛋黄南瓜#还是可以的, the level has not decreased, and it is good to eat it while it is hot."
38150,8,#豆腐#大概就是豆腐里面夹着肉馅，还行。,"#豆腐#大概就是豆腐里面夹着肉馅, it's ok."
38150,9,点评服务，我们3个人，点了六七个菜，其中2个有小份，我特别重复要小份，上来的全部是大份，先不说钱的问题，吃不了就都浪费了！,"Comment service, 3 of us, ordered six or seven dishes, 2 of which have small portions, I especially repeated to small portions, all the ones that came up are large portions, not to mention the problem of money, can't eat it is wasted!"
38150,10,希望贵店加强培训，不建议顾客要小份就算了，在顾客强调要小份的时候还直接点了大份，你们差那几十块钱吗？,"I hope that your store will strengthen training, and it is not recommended that customers want small portions, and when customers emphasize that they want small portions, they also directly order large portions, are you short of dozens of dollars?"
38150,11,直接给你们当小费都行，能不浪费食物吗？！,"I can just tip you guys, can I not waste"
38150,12,本次翠满楼之行着实失望，肯定不会再去了。,"food?! This trip to Cuimanlou is really disappointing, and I will definitely not go again."
23068,0,感谢点评的代金卷，店很好找，离地铁很近，交通方便。,"Thanks for the review of the voucher, the shop is easy to find, close to the subway, convenient transportation."
23068,1,店面虽然不大楼上楼下两层，但是装修很别致，餐位错落有致，很有感觉。,"Although the store does not have two floors up and down, the decoration is very chic, and the dining places are scattered, which is very feeling."
23068,2,周末去的，人略多，需要等一会。,"I went on the weekend, there were slightly more people, so I had to wait a while."
23068,3,重庆老灶火锅最著名的当然是九宫格，,"The most famous Chongqing Laozao hot pot is, of course, Jiugongge, but recently I can't eat spicy and ask for a clear soup pot, and a big pot comes up, and my appetite is immediately suspended."
23068,4,但是最近不能吃辣就要了清汤锅，一大锅上来，胃口立马被吊了起来。首先清汤锅底非常便宜，30左右但是里面的料可是给的十足，真心超值值，各种菇类，平菇，香菇，金针菇等，都,"First of all, the bottom of the clear soup pot is very cheap, about 30, but the ingredients inside are full, really value-for-money, all kinds of mushrooms, oyster mushrooms, shiitake mushrooms, enoki mushrooms, etc., are almost a platter of amounts, the soup is also very delicious, and it feels very good to drink a little before the meat."
23068,5,差不多有个拼盘的量了，汤也很鲜美，下肉之前喝上一点感觉很不错。点的鲜,"The fresh mutton and tender beef ordered are full of portions, the meat is very fresh, the cut is also very even, and the taste is very good."
23068,6,羊肉和嫩牛肉，分量十足，肉很,The green cabbage is very appetizing when it looks green.
23068,7,新鲜，切的也很均匀，涮着口感很好。青菜绿油油的看着就很有食欲,"The material platter is great value and filling, and if two or three people eat it, you don't have to order other vegetables."
23068,8,。素材拼盘很超值，量足，如果两三个人吃，就不用再点其他蔬菜了。毛肚也很不错，应该是,"The hairy belly is also very good, it should be a specialty here, it is clean, and it is crispy and tender to eat, so you must order it."
23068,9,这里的特色菜，处理的干净，涮起来吃着脆脆的，嫩嫩的，一定要点。火锅小料是自助式的，,"The hot pot ingredients are self-service, 6 yuan, the categories are very complete, I love sesame sauce, of course, there are some xo sauces and sand tea sauces and the like."
23068,10,6元，品类很齐全，最爱麻酱，当然还有一些xo酱和沙茶酱之类,"\\nThe main food is recommended for the baked cake, sesame, crunchy, slightly oily, but very fragrant."
23068,11,的。\\n主食推荐烧饼，芝麻的，脆脆的，略微有点油，但是很香。\\n店里的服务也不错，点菜积极，,"The service in the store is also good, the order is positive, the food is served quickly, the soup is added and removed in a timely manner, and there is also a warm greeting and introduction when entering the"
23068,12,上菜速度快，加汤撤盘都很及时，进门的时候也有热情的招呼和引位。\\n总之是一次非常好的体验，下次有机会还会去。,"door. \\nAll in all a very good experience, will go next time I have the chance."
