id,sentence_index,source_text,translated_text
46277,0,状元楼饭店第一次去，因为地理位置优越：在宁波市和义大道高、大、上，里面装修中式，菜是地道的宁波菜，口味纯正，醉泥螺特棒，吃到了小时候的味道，因为去了晚了，在大堂等了一会儿，期间有茶水喝、服务员还与你聊天，到了就餐时生意太好，服务员都是小跑状，服务态度绝对不提速，样样都服务到位，点酒水还耐心的与我们解释，就这样绝对要夸一夸，,"Zhuangyuanlou Hotel went for the first time, because of the geographical location: in Ningbo City and Yi Avenue high, big, on, inside the decoration of Chinese, the dish is authentic Ningbo cuisine, the taste is pure, drunk mud snail is particularly good, eat the taste of childhood, because I went late, waited in the lobby for a while, during which there is tea to drink, the waiter also chats with you, to the dining business is too good, the waiter is trotting, the service attitude is absolutely not speedy, everything is in place, the drink is also patiently explained to us, so it is absolutely necessary to boast,"
46277,1,特别是彭新星、洪继华（看服务牌才知道名字）也给我们宁波市形象增色，状元楼是宁波的一扇窗口，服务员的素质更体现我们宁波人的精神面貌。,"In particular, Peng Xinxing and Hong Jihua (only know the name by looking at the service card) also add color to our image of Ningbo, the champion building is a window in Ningbo, and the quality of the waiter reflects the spiritual outlook of our Ningbo"
46277,2,赞一个,people. Like one
23691,0,我最爱他们家的猪手，麻辣鸡爪，肉片口磨，道道菜都是家常菜的味道，非常的好吃，是原来的昊烨，和长白街北的强烨饭店，是仔妹店，相同却又不是太相同，弥补了强烨的一个遗憾，就是强烨现在没有宵夜了，老妈家有宵夜，10点以后可以过来。,"I love their pork knuckles, spicy chicken feet, meat slices and mouth grinding, the dishes are all home-cooked taste, very delicious, it is the original Haoye, and the Qiangye restaurant in the north of Changbai Street, it is a sister shop, the same but not too the same, to make up for one of Qiangye's regrets, that is, Qiangye has no supper now, and there is a supper at my mother's house, and you can come over after 10 o'clock."
23691,1,整体用餐环境，干净整洁，简单清爽，有上下两层.,"The overall dining environment is clean and tidy, simple and refreshing, with two floors."
23691,2,服务也是很到位！,The service is also in place!
23691,3,老板人超级好，特别好说话！,The owner is super nice and especially easy to talk to!
23691,4,南京地地道道的本土菜，需要支持一下！！！,Nanjing's authentic local cuisine needs to be
23691,5,适合亲朋好友稍微小聚一下，门口就是公交站台，非常方便！,"supported!! It is suitable for a small gathering of relatives and friends, and the bus stop is at the door, which is very convenient!"
23660,0,我是比较喜欢荣新馆的，因为材料新鲜，服务又好，价格适中，但是老公每次吃都会拉肚子，特神奇，我喜欢鳌虾，感觉比牡丹虾好吃，但是我们这种小胃口，一人四个也就饱了。,"I prefer Rongxinguan, because the materials are fresh, the service is good, and the price is moderate, but my husband will have diarrhea every time he eats, which is amazing, I like crayfish, and I feel better than peony shrimp, but we have a small appetite, and one person is full of four."
23660,1,对于不吃鱼的人来说，吃日料真的比较亏，只能吃螃蟹，海胆和海螺等带壳海鲜。,"For people who don't eat fish, it's really a loss to eat Japanese food, and they can only eat shell seafood such as crabs, sea urchins, and conchs."
23660,2,里面服务员一直很热情，会叫我们多点些，可能每次来，给服务员感觉都是我们吃的太少了，但是感觉这里一直是海鲜食材新鲜，但是熟物的味道，我感觉一般，没有那么惊艳。,"The waiter inside has been very enthusiastic, will ask us to order more, maybe every time I come, to the waiter feels that we eat too little, but I feel that the seafood here has always been fresh, but the taste of cooked food, I feel average, not so"
23660,3,给予四星，是因为老公会拉肚子，上次我弟弟也拉肚子，貌似女生都好好的，男生就难说了！,"amazing. I gave four stars because my husband had diarrhea, and my brother also had diarrhea last time, and it seems that girls are fine, but boys are hard to say!"
379,0,8.8秒杀的多嘴肉蟹煲，第一天开业就去了，大众点评很给力，排了两个半小时的队才轮到，他家很年轻化，服务员不时出来跳舞啥的，挺有意思，第一天分享还有小礼物，点赞还送饮料，可惜没赶上，点了8元一份的米饭，米饭是砂锅装的，非常好吃，泡多嘴肉蟹煲的汤吃更棒，还点了一个馍，沾着辣肉酱吃，得趁热吃，不然馍就硬不好吃了，肉蟹煲里面很丰富，,"8.8 seconds to kill the multi-mouth meat and crab pot, the first day of opening on the go, the public reviews are very powerful, queued for two and a half hours before it was the turn, his family is very young, the waiter comes out from time to time to dance or something, very interesting, the first day to share and a small gift, like and send a drink, but unfortunately did not catch up, ordered 8 yuan a piece of rice, the rice is a casserole, very delicious, the soup of the multi-mouth meat crab pot is better, and ordered a bun, dipped in spicy meat sauce to eat, you have to eat it while it is hot, otherwise the bun will be hard and not delicious, the meat and crab pot is very rich,"
379,1,满满一大锅，里面有螃蟹，大虾，年糕，鸡爪，螃蟹肉很多，真的是肉蟹，鸡爪很好吃，做的软糯的，非常不错，里面还有花生腐竹，味道都不错，服务也很到位，开业第一天最后吃完的，服务员还送了西瓜，很贴心，还会再来的，推荐哦，大家都快点来吃吧，非常划算的,"Full of a big pot, there are crabs, prawns, rice cakes, chicken feet, a lot of crab meat, it is really meat crabs, chicken feet are delicious, soft and glutinous, very good, there are peanuts and bean curd in it, the taste is good, the service is also in place, the first day of the opening of the last to eat, the waiter also sent watermelon, very intimate, will come again, recommended Oh, everyone hurry up to eat, very cost-effective"
13811,0,喜欢KOI好多年了，但是看着它的价格在一路飙涨，真心是有点越来越爱不起来了呢。,"I've loved KOI for many years, but seeing its price soaring, I'm really getting a little bit out of it."
13811,1,不过还好有大众点评的闪惠，每周四半价，太便宜啦~棒棒的~~\\n还是一如既往点了最爱的蒟蒻，其实也不是真的蒟蒻啦，就是椰果，但是我就是好喜欢呢。,"But fortunately, there are flash discounts from public reviews, half price every Thursday, it's too cheap~ Awesome~~\\n I still ordered my favorite konjac as always, in fact, it's not really konjac, it's coconut fruit, but I just like it."
13811,2,而且一定是要微糖，常温，这样才是最好的味道。,"And it must be slightly sugary, room temperature, so that it tastes best."
13811,3,大杯22，中杯17.\\n朋友爱吃仙草，所以给他点了仙草蜜，满满一大杯的仙草，也是不错吃的呢。,"Large cup 22, medium cup 17.\\nFriends love to eat fairy grass, so I ordered him fairy grass honey, a large cup full of fairy grass, which is also delicious."
13811,4,中杯18.\\n蔡塘广场的这家不是很好找。,Medium Cup 18.\\n This one in Caitang Square is not easy to find.
13811,5,在一楼的广场中央，幸得小伙伴指点，在钓鱼池的旁边。,"In the middle of the square on the first floor, fortunately with the guidance of my friends, next to the fishing pond."
13811,6,也有几张桌子可以坐人。,There are also a few tables where people can
13811,7,还是不错的。,sit. It's still good.
26476,0,"月底就是父亲生日了今天去给老爸订了个板栗蓉的蛋糕，感觉很划算，现在大众点评网搞活闪付5折很划算,订108元的蛋糕只用支付68，活动名额有限喔！","At the end of the month, it is my father's birthday, and today I went to order a cake with chestnut paste for my father, which feels very cost-effective, and now Dianping.com is very cost-effective to activate the flash payment, and it is very cost-effective to order a cake of 108 yuan only to pay 68, and the number of places in the event is limited!"
26476,1,每天10点开始抢完为止！,Grab it from 10 o'clock every day!
26476,2,除了可以订生日蛋糕，买月饼、面包蛋糕也可以，只要是店里卖的都可以要！,"In addition to ordering birthday cakes, you can also buy moon cakes, bread and cakes, as long as they are sold in the store, you can ask for them!"
26476,3,十分划算，活动到2015.10.17止喔！,"It's a good deal, and the event ends on"
26476,4,"滋味蛋糕味道不错，25一个吃起来嫩嫩的感觉，今天一下买了2个当早餐吃，还有可爱的小熊蛋糕好可爱,下次还会光顾喜莲娜，你也来试试吧","2015.10.17! The taste cake tastes good, 25 a tender feeling to eat, today I bought 2 for breakfast, and the cute bear cake is so cute, next time I will visit Helina, you can also try it"
13894,0,嗯，第三次来了，西米糕没有了，遗憾；,"Well, the third time it came, the sago cake was gone, a pity;"
13894,1,中午来的时候还是人多要等，估计和工作日有关，上次工作日晚上来的，就没等什么；,"When I came at noon, there were still a lot of people to wait, and it was estimated that it was related to the working day, and I didn't wait for anything when I came up late on the last working day;"
13894,2,所以大家注意时间去；,So everyone pay attention to the time to go;
13894,3,冬阴功汤比上次味道略淡，但是老板是说怕有些客人不喜欢重口，但是我建议还是按照风味来，毕竟可以在点菜的时候解说下；,"Tom Yum soup is slightly lighter than last time, but the boss said that he was afraid that some guests would not like heavy bites, but I suggest that it should be according to the flavor, after all, you can explain it when ordering;"
13894,4,就是上菜要一桌一桌来上……,"That is, the food should be served table by table......"
13894,5,猪颈肉刚觉比上次好吃，柠檬鱼也是很新鲜，都吃完了，推荐。,"The pork neck meat is better than last time, and the lemon fish is also very fresh, and it is recommended to eat it."
13894,6,\\n可能店不是很大，服务员也不多，今天就一个妹子，有时候喊不过来，等待一长就添茶水比较慢。,"\\nMaybe the store is not very big, and there are not many waiters, just a girl today, sometimes you can't shout, and it's slower to wait for a long time to add"
13894,7,\\n然后就是现在有闪单优惠，还是划算。,"tea. \\nAnd then there is now a flash order discount, which is still a good deal."
27690,0,本来没打算吃火锅的，这家味道实在太香....,"I didn't plan to eat hot pot, but this one tastes so fragrant...."
27690,1,店里有实付100送50抵价券的活动，还好优惠买单叠加，又送饮料菜品啥的，两个人吃了160超划算！,"There is an activity in the store that pays 100 and gets 50 coupons, but fortunately, the discount is superimposed, and the drinks and dishes are sent, and the two people eat 160 super cost-effective!"
27690,2,\\n菜品讲道理一般，招牌的虾球丸子还可以，其他标准水平，比较细节的是娃娃菜切的很细，这在火锅里比较少见，但能在蔬菜上下功夫，还是蛮用心的orz\\n环境不错，交通方便，服务员热情又不让人尴尬，不插话不打断客人，叫的时候随时能过来\\n也有差评项，水果切的有味道...,"\\nThe dishes are reasonable, the signature shrimp ball balls are OK, other standard levels, the more detailed is that the baby cabbage is cut very finely, which is relatively rare in the hot pot, but it can work vegetables, or quite attentive orz\\n The environment is good, the transportation is convenient, the waiter is enthusiastic and not embarrassing, do not interrupt the guests, you can come over at any time when you call\\nThere are also bad reviews, and the fruit is cut with"
27690,3,刀没洗干净吧,taste... The knife hasn't been cleaned
39309,0,这店在仓边路公车站附近 老字号,"This restaurant is located near the bus stop on Cangbian Road, and it is a small restaurant with an affordable price."
39309,1,是一家价格实惠的简餐店。以快餐和,"It is mainly fast food and porridge noodles, and there are also stir-fried noodles."
39309,2,粥粉面为主 也有小炒等。环境一般 就是普通的装修,"The environment is generally an ordinary decoration on the first floor, the second floor and the mezzanine, quite a lot of seats."
39309,3,有一楼二楼和夹层,"The mezzanine space is relatively cramped, and you generally choose the first or second floor for dining."
39309,4,挺多座位的。夹层空间比较局促,"Regular production, no surprises, just simple and fast."
39309,5,一般选择一楼,No WiFi.
39309,6,或二楼用餐,Cash bills.
39309,7,。常规出品 没什么惊喜,\\n\\nBoiled beef The beef is quite tender and the side dish is bean sprouts.
39309,8,就是简便快捷。没WiFi。现金埋单,The amount of barbecued pork fat beef rice noodles can be refreshing.
39309,9,。\\n\\n水煮牛肉,"Boiled lettuce, but it doesn't taste"
39309,10,牛肉挺嫩滑的 配菜是豆芽。叉烧肥牛米粉 分量可以 米粉爽口。水煮生菜 不过不失 没什么味道。以前吃过这里的粥 听说是招牌 但是粥底真的不怎么 不够绵 再来也不会吃粥。,"good. I've eaten porridge here before, and I've heard that it's a signboard, but the bottom of the porridge is really not very good, not enough to be soft, and I won't eat porridge again."
8664,0,"其实本来是要去吃郑爽爽咖喱羊排的,可是,没想到杀过去的时候店门竟然没开,明明那时候已经12点了呀Ծ‸Ծ难道是周日店休么。。。","Actually, I was going to eat Zheng Shuangshuang's curry lamb chops, but, I didn't expect the store to be open when I killed it, and it was already 12 o'clock at that time."
8664,1,"好讨厌的感觉啊啊啊,尤其是刚刚交完5块钱停车费的人表示心好塞啊啊啊,鉴于已经停了车,而且这一代平时也不太会专程来,那就干脆在附近觅个食吧。","It's a nasty feeling, especially the person who just paid the 5 yuan parking fee said that he was so congested, in view of the fact that the car has been parked, and this generation usually doesn't usually make a special trip, so just look for food nearby."
8664,2,"打开点评的APP一搜,忽然发现旁边有美邻扁食,印象之前在微博上也看到过好几次,貌似是老字号了,那就随遇而安走一个呗。","Open the APP of the review and search, and suddenly found that there is a beautiful neighbor next to it, and I have seen it several times on Weibo before, and it seems to be a time-honored brand, so let's go with it."
8664,3,"\\n店面不大,装修也很简单,不过人气很旺的样子,一直有客人进进出出,翻桌率很高。","\\nThe store is not big, and the decoration is very simple, but it is very popular, and there are always customers coming in and out, and the table turnover rate is very high."
8664,4,"店里东西不算很丰富,简单几样扁食拌面猪肝汤脱骨肉汤,以及猪肝跟脱骨肉单拌跟加面。","The things in the store are not very rich, just a few kinds of flat food mixed noodles, pork liver soup, boneless broth, and pork liver and boneless meat mixed with noodles."
8664,5,"要了扁食拌面以及一份猪肝汤面,出菜速度那叫一个快,咻咻的。","I asked for flat noodles and a pork liver soup noodle, and the speed of the dish was called a fast, sigh."
8664,6,"卖相就是非常classic的扁食拌面,分量适中,汤热乎乎的,在这阴冷阴冷的天气真是非常舒服。","It looks like a very classic flat noodles, the portion is moderate, the soup is hot, and it is really comfortable in this cold and cold weather."
8664,7,"汤头甜的出乎意料,正在寻思是不是加了啥调料,忽然听到进门一个老客人点餐说扁食不要加味精,恍然大悟,原来如此,还可以要求不加味精的啊？!不过汤里本身就有冬菜跟葱花,其实即便只是清汤也不会差。","The soup was unexpectedly sweet, and I was thinking about whether I had added any seasoning, and suddenly I heard an old guest ordering food that said that flat food should not be added to MSG, and suddenly realized, I see, you can also ask for no MSG."
8664,8,"扁食很Q弹,不过感觉偏咸,店里也有生的让人打包回家自己煮。","The flat food is very Q-bomb, but it feels salty, and there are raw ones in the store that people can take home and cook by themselves."
8664,9,"出乎意料的是拌面跟猪肝面都很好吃,拌面加了一点点汤所以不会太干,花生酱吃起来真是香!!","Surprisingly, the noodles and pork liver noodles are delicious, the noodles are added with a little soup so they are not too dry, and the peanut butter tastes really delicious!!"
8664,10,"猪肝脆脆的口感也很棒,难怪那么多人直接点拌猪肝。","The crunchy texture of pork liver is also great, no wonder so many people order pork liver"
8664,11,"3碗一共21,吃的浑身暖洋洋的,真舒服啊,下次有经过可以再来一碗୧( ""̮ )୨✧ᐦ̤","directly. 3 bowls of a total of 21, eat warm all over, really comfortable, next time you have to have another bowl ୧ ( ""̮ ) ୨✧ᐦ ̤"
35904,0,被朋友意外拉来重庆玩，简直是一场说走就走的旅行。,Being accidentally pulled to Chongqing by a friend to play is simply a trip that is just about to go.
35904,1,去重庆的前一天还在纠结到底是重庆还是成都，然而第二天就妥妥的买了重庆的票。,"The day before I went to Chongqing, I was still struggling with whether it was Chongqing or Chengdu, but the next day I bought a ticket for Chongqing."
35904,2,其实两个城市对我而言都是满意的，因为火锅，因为麻辣。,"In fact, both cities are satisfactory to me, because of the hot pot, because of the spicy."
35904,3,\\n\\n第一天到了已经中午11点，人困马乏，所以打算休息一会下午去解放碑逛吃逛吃。,"\\n\\nIt was already 11 o'clock at noon on the first day, and people were sleepy and tired, so I planned to rest for a while and go to the Liberation Monument to eat and eat in the afternoon."
35904,4,好吃街因为离解放碑超近所以也成为大家慕名而来的地方，这条小吃街虽然短，但是食物真的是超级好吃啊。,"Because it is very close to the Liberation Monument, the food street has also become a place where everyone comes to visit, although this snack street is short, but the food is really super delicious."
35904,5,好又来酸辣粉一直是朋友的强烈推荐，也是各个美食吃货家们必需来一碗的小吃，我当然也不例外。,"Haoyoulai hot and sour noodles have always been highly recommended by friends, and they are also a must-have snack for foodies of all kinds of foodies, and I am certainly no exception."
35904,6,\\n\\n一开始没有找对地方，导航真的是太不给力，带着我们直绕圈，在王府井往前也有一家好又来，但是并没有酸辣粉，只有绿色的凉皮还有烤鱿鱼之类的，这家我们也吃了，主要是一开始你找到。,"\\n\\n didn't find the right place at the beginning, the navigation was really too weak, with us straight around the circle, there was also a good one in front of Wangfujing, but there was no hot and sour powder, only green cold skin and grilled squid and the like, this we also ate, mainly at the beginning you found."
35904,7,后来去了一家买冰水喝，问了老板好吃街的具体地点，才发现原来这么近，呵呵呵，简直了。,"Later, I went to a store to buy ice water to drink, and asked the boss the specific location of the delicious street, only to find that it was so close, hehehe, it's simple."
35904,8,一眼就看到了排了好多人的好又来酸辣粉，好多人都端着碗在小小的店铺门口吃的超级爽。,"At a glance, I saw that there were a lot of people lined up and there were hot and sour noodles, and many people were eating super cool at the door of the small store with bowls."
35904,9,我们虽然刚才也吃了不少，但还是又来了一碗酸辣粉还有刨冰吧。,"Although we ate a lot just now, we still had another bowl of hot and sour noodles and shaved ice."
35904,10,酸辣粉上面是杂酱，味道非常过瘾麻辣，吃得好嗨，爱吃辣的人绝对不能错过，然后配着挫冰吃，简直爽爆了好吗！,"The hot and sour noodles are topped with mixed sauce, the taste is very enjoyable and spicy, it is so good to eat, people who love spicy food must not miss it, and then eat it with frustrated ice, it is simply refreshing!"
35904,11,然后呢，价钱也不贵，6块钱一碗，较于其他地方，重庆来说物价相对来说还是便宜的，毕竟放假便宜吧，这样食物里的存在成本自然也低。,"Then, the price is not expensive, 6 yuan a bowl, compared to other places, the price of Chongqing is relatively cheap, after all, the holiday is cheap, so the cost of food is naturally"
35904,12,刨冰还是挫冰也是6块，但是真的很好吃啊。,"low. There are 6 pieces of shaved ice or frustrated ice, but it's really delicious."
15584,0,在来福士逛，过了饭点不想去吃正餐就在地下一层随便逛逛，出了室内区域就看到了这家店，搜了下点评感觉还可以就进去了，过了饭点店里的人不算很多，点了个套餐，米线有点过桥米线的感觉生的食材现场放锅里，点了番茄的底，米线还挺入味的，汤也好喝，作为一个对汤没有抵抗力的人依旧是喝光汤的节奏，豆浆是用粉泡的基本口味跟kfc的豆浆持平，,"Shopping in Raffles, after the meal, I don't want to eat the main meal on the basement floor casually, out of the indoor area I saw this store, searched for reviews and felt that I could go in, after the meal, there are not many people in the shop, I ordered a set meal, the rice noodles are a little over the bridge rice noodles feel raw ingredients are put in the pot on the spot, the bottom of the tomato is ordered, the rice noodles are still quite flavorful, the soup is also delicious, as a person who has no resistance to the soup is still the rhythm of drinking the soup, the soybean milk is soaked in powder The basic taste is the same as the soybean milk of KFC,"
15584,1,肉串味道也蛮好的，是比较满意的简餐，车子停在来福士现在凭吃饭的小票消费满额可以去服务台领5块的停车券，之前忘了买单的时候想来店家也帮忙重新打印单子了服务态度还挺好的,"The meat skewers taste quite good, it is a simple meal that is more satisfying, the car is parked in Raffles, and now you can go to the service desk to get a parking coupon of 5 yuan with a meal ticket full consumption, and you forgot to pay when you want to come to the store to help reprint the list, and the service attitude is very good"
491,0,Baker&Spice是上海Wagas（沃歌斯，后文为方便起见均用该名称代指Baker&Spice）旗下的餐厅。,Baker &Spice is a restaurant owned by Wagas in Shanghai.
491,1,沃歌斯青岛首家餐厅位于万象城LG层中门外侧，意外不是很起眼的位置，在猪头肉印象里这家餐厅也相对比较低调，一直不温不火。,"The first restaurant in Qingdao is located outside the middle gate of the LG floor of the MixC, which is unexpectedly not very inconspicuous, and this restaurant is relatively low-key in the impression of pork head meat, and has been tepid."
491,2,正如其名，该餐厅的主营的糕点和意面披萨等简餐都有非常不错的水准。,"As the name suggests, the restaurant's main menu of pastries, pasta, pizza and other light meals is of a very good standard."
491,3,近期经常来沃歌斯，所以就做一下较深度点评。,"I've been coming to Wagas a lot lately, so I'll make a more in-depth review."
491,4,\\n\\n,"\\n\\n The furnishings of Wagas are simple and bright, with a Nordic style."
491,5,沃歌斯的装修陈设简洁明亮，偏向北欧范儿。而没做吊顶,And the bare ceiling without a suspended ceiling and the hanging incandescent lamp have a hint of industrial style.
491,6,的裸顶和垂下来的白炽灯又带着一丝工业风。高,The high-end literary environment has successfully elevated the restaurant's style.
491,7,端文艺范的环境已经成功拉升了餐厅的格调。\\n,"\\n Ordered two salads at Wagas, one Caesar salad and one chicken mango salad."
491,8,在沃歌斯点过两次沙拉，一次凯撒沙拉一次鸡肉芒果沙拉。虽然猪头肉并不喜,"Although pork head doesn't like lettuce-heavy salads, Wagas salads do taste very good."
491,9,欢吃生菜多的沙拉，不过,Caesar salad is a classic dish.
491,10,沃歌斯的沙拉味道确实非常不错。凯撒沙拉是经典名菜了。,"Wagas's Caesar salad is no chicken by default, and it costs 18 yuan to add chicken."
